{
  "schema_version": 1,
  "grammar": "rfc5280-x509",
  "total_samples": 1,
  "hits": {
    "rfc5280-x509:AlgorithmIdentifier#06ae8df8": 1,
    "rfc5280-x509:AlgorithmIdentifier#3a3792d4": 1,
    "rfc5280-x509:AlgorithmIdentifier#72e13630": 1,
    "rfc5280-x509:AlgorithmIdentifier#7811cb18": 1,
    "rfc5280-x509:AlgorithmIdentifier#c05a33c5": 1,
    "rfc5280-x509:AlgorithmIdentifier#e88e3a7f": 1,
    "rfc5280-x509:AlgorithmIdentifier#fcb3c20b": 1,
    "rfc5280-x509:AttributeType#9449df54": 1,
    "rfc5280-x509:AttributeType#dda49c08": 1,
    "rfc5280-x509:AttributeTypeAndValue#4cd33458": 1,
    "rfc5280-x509:AttributeTypeAndValue#6c30cf16": 1,
    "rfc5280-x509:AttributeTypeAndValue#6c9372ba": 1,
    "rfc5280-x509:AttributeTypeAndValue#916db0b3": 1,
    "rfc5280-x509:AttributeTypeAndValue#9e1ea754": 1,
    "rfc5280-x509:AttributeTypeAndValue#be341a7b": 1,
    "rfc5280-x509:AttributeValue#875a1ad1": 1,
    "rfc5280-x509:AttributeValue#f6e6227e": 1,
    "rfc5280-x509:Certificate#411e9457": 1,
    "rfc5280-x509:Certificate#49f9675f": 1,
    "rfc5280-x509:Certificate#62edc556": 1,
    "rfc5280-x509:Certificate#89308421": 1,
    "rfc5280-x509:Certificate#ae0172ed": 1,
    "rfc5280-x509:Certificate#b05c5470": 1,
    "rfc5280-x509:Certificate#bc362a5b": 1,
    "rfc5280-x509:Certificate#fe0cc5c5": 1,
    "rfc5280-x509:CertificateSerialNumber#4fb91908": 1,
    "rfc5280-x509:CertificateSerialNumber#8e757afb": 1,
    "rfc5280-x509:DirectoryString#1fa99e34": 1,
    "rfc5280-x509:DirectoryString#752dbc67": 1,
    "rfc5280-x509:DirectoryString#d55a7eca": 1,
    "rfc5280-x509:DirectoryString#efa12921": 1,
    "rfc5280-x509:Extension#2809b3dc": 1,
    "rfc5280-x509:Extension#5d69ce97": 1,
    "rfc5280-x509:Extension#615a0530": 1,
    "rfc5280-x509:Extension#6856da06": 1,
    "rfc5280-x509:Extension#ab701233": 1,
    "rfc5280-x509:Extension#b12c40a2": 1,
    "rfc5280-x509:Extension#d51aa96a": 1,
    "rfc5280-x509:Extension#d96a2622": 1,
    "rfc5280-x509:Extension#e4e3bb85": 1,
    "rfc5280-x509:Extensions#0d96282d": 1,
    "rfc5280-x509:Extensions#4eae8222": 1,
    "rfc5280-x509:Extensions#68267b18": 1,
    "rfc5280-x509:Name#2c01aff4": 1,
    "rfc5280-x509:Name#d9debf60": 1,
    "rfc5280-x509:Name#ec9765ee": 1,
    "rfc5280-x509:Name#edd993ec": 1,
    "rfc5280-x509:RDNSequence#50c2eb75": 1,
    "rfc5280-x509:RDNSequence#62620965": 1,
    "rfc5280-x509:RDNSequence#aae87424": 1,
    "rfc5280-x509:RelativeDistinguishedName#14dfad6b": 1,
    "rfc5280-x509:RelativeDistinguishedName#91c10a68": 1,
    "rfc5280-x509:RelativeDistinguishedName#e53ba801": 1,
    "rfc5280-x509:SubjectPublicKeyInfo#00bea8d6": 1,
    "rfc5280-x509:SubjectPublicKeyInfo#3063e642": 1,
    "rfc5280-x509:SubjectPublicKeyInfo#631408cc": 1,
    "rfc5280-x509:SubjectPublicKeyInfo#68412ab8": 1,
    "rfc5280-x509:SubjectPublicKeyInfo#7940eec9": 1,
    "rfc5280-x509:SubjectPublicKeyInfo#c7f2bd78": 1,
    "rfc5280-x509:TBSCertificate#1dea0a4b": 1,
    "rfc5280-x509:TBSCertificate#2122b722": 1,
    "rfc5280-x509:TBSCertificate#24aaec51": 1,
    "rfc5280-x509:TBSCertificate#2f51cb32": 1,
    "rfc5280-x509:TBSCertificate#42627204": 1,
    "rfc5280-x509:TBSCertificate#46dd1e82": 1,
    "rfc5280-x509:TBSCertificate#4efe880e": 1,
    "rfc5280-x509:TBSCertificate#5db58754": 1,
    "rfc5280-x509:TBSCertificate#6828bd8b": 1,
    "rfc5280-x509:TBSCertificate#7349ce04": 1,
    "rfc5280-x509:TBSCertificate#7a48a7d5": 1,
    "rfc5280-x509:TBSCertificate#80b6dc2a": 1,
    "rfc5280-x509:TBSCertificate#82375b9a": 1,
    "rfc5280-x509:TBSCertificate#8c269598": 1,
    "rfc5280-x509:TBSCertificate#9420d091": 1,
    "rfc5280-x509:TBSCertificate#943e3676": 1,
    "rfc5280-x509:TBSCertificate#ba1961a0": 1,
    "rfc5280-x509:TBSCertificate#bd4ccf0c": 1,
    "rfc5280-x509:TBSCertificate#bd6bfeb6": 1,
    "rfc5280-x509:TBSCertificate#c0833b22": 1,
    "rfc5280-x509:TBSCertificate#c3ad2134": 1,
    "rfc5280-x509:TBSCertificate#d51f69e3": 1,
    "rfc5280-x509:Time#053ad7df": 1,
    "rfc5280-x509:Time#8c2a74b1": 1,
    "rfc5280-x509:Time#a5d5979e": 1,
    "rfc5280-x509:Time#b5d33999": 1,
    "rfc5280-x509:Validity#502fa4d5": 1,
    "rfc5280-x509:Validity#8469c8ed": 1,
    "rfc5280-x509:Validity#c49bfef9": 1,
    "rfc5280-x509:Validity#c9a15ab6": 1,
    "rfc5280-x509:Validity#ea820b6f": 1,
    "rfc5280-x509:Validity#f54af9e3": 1,
    "rfc5280-x509:Version#1eec8795": 1,
    "rfc5280-x509:Version#e67c7da4": 1
  }
}
