{
  "schema_version": 1,
  "grammar": "rfc3986-uri",
  "total_samples": 14,
  "hits": {
    "rfc3986-uri:ALPHA#a4f7d319": 14,
    "rfc3986-uri:ALPHA#beb3410a": 14,
    "rfc3986-uri:ALPHA#e14400e0": 14,
    "rfc3986-uri:DIGIT#0a14dd82": 7,
    "rfc3986-uri:DIGIT#8d4940dd": 7,
    "rfc3986-uri:HEXDIG#1ba197e5": 1,
    "rfc3986-uri:HEXDIG#48f6aa06": 2,
    "rfc3986-uri:HEXDIG#7318c78b": 1,
    "rfc3986-uri:HEXDIG#8acdba61": 1,
    "rfc3986-uri:HEXDIG#b6d02e8e": 2,
    "rfc3986-uri:HEXDIG#d243eda3": 2,
    "rfc3986-uri:IP-literal#05d46745": 1,
    "rfc3986-uri:IP-literal#1bca6b29": 1,
    "rfc3986-uri:IP-literal#1c968bc3": 1,
    "rfc3986-uri:IP-literal#1fc06280": 1,
    "rfc3986-uri:IP-literal#615ca5b3": 1,
    "rfc3986-uri:IP-literal#d3d5893c": 1,
    "rfc3986-uri:IP-literal#ea51ea7b": 1,
    "rfc3986-uri:IPv4address#1dd6bd5e": 1,
    "rfc3986-uri:IPv4address#394cf479": 1,
    "rfc3986-uri:IPv4address#605943cc": 1,
    "rfc3986-uri:IPv4address#69c9d9e0": 1,
    "rfc3986-uri:IPv4address#72adee99": 1,
    "rfc3986-uri:IPv4address#858ec30c": 1,
    "rfc3986-uri:IPv4address#902d5572": 1,
    "rfc3986-uri:IPv4address#b10f42ae": 1,
    "rfc3986-uri:IPv4address#d1e871a6": 1,
    "rfc3986-uri:IPv6address#1225d44b": 1,
    "rfc3986-uri:IPv6address#1a5ba20b": 1,
    "rfc3986-uri:IPv6address#27d98cbf": 1,
    "rfc3986-uri:IPv6address#46c3bea2": 1,
    "rfc3986-uri:IPv6address#8f584802": 1,
    "rfc3986-uri:IPv6address#9ba63d3b": 1,
    "rfc3986-uri:IPv6address#a207648f": 1,
    "rfc3986-uri:IPv6address#a6c8b444": 1,
    "rfc3986-uri:IPv6address#bd1d8fd5": 1,
    "rfc3986-uri:IPv6address#c38a6c3b": 1,
    "rfc3986-uri:IPv6address#cc61b806": 1,
    "rfc3986-uri:IPv6address#ebd1fe8d": 1,
    "rfc3986-uri:IPv6address#f4a39617": 1,
    "rfc3986-uri:URI#049d1fee": 14,
    "rfc3986-uri:URI#0c142d58": 2,
    "rfc3986-uri:URI#153996f6": 14,
    "rfc3986-uri:URI#1c64989c": 14,
    "rfc3986-uri:URI#1f3ada6f": 2,
    "rfc3986-uri:URI#400a6387": 14,
    "rfc3986-uri:URI#4c4da3ed": 14,
    "rfc3986-uri:URI#4f9432b5": 14,
    "rfc3986-uri:URI#5eff9c7f": 2,
    "rfc3986-uri:URI#9c3d73c4": 2,
    "rfc3986-uri:URI#ba27121c": 14,
    "rfc3986-uri:URI#e7cf0116": 2,
    "rfc3986-uri:URI#f4cde077": 2,
    "rfc3986-uri:authority#0103ac91": 2,
    "rfc3986-uri:authority#051de496": 1,
    "rfc3986-uri:authority#0c6f76d8": 1,
    "rfc3986-uri:authority#512458d2": 2,
    "rfc3986-uri:authority#671c00e6": 11,
    "rfc3986-uri:authority#81c1be29": 11,
    "rfc3986-uri:authority#96659858": 11,
    "rfc3986-uri:authority#be2402e7": 11,
    "rfc3986-uri:authority#c2bc8522": 2,
    "rfc3986-uri:authority#d8ee8dd6": 1,
    "rfc3986-uri:authority#f96c881a": 11,
    "rfc3986-uri:dec-octet#015f95d2": 1,
    "rfc3986-uri:dec-octet#692ae727": 1,
    "rfc3986-uri:dec-octet#abc2452d": 1,
    "rfc3986-uri:dec-octet#c20c3f36": 1,
    "rfc3986-uri:dec-octet#c352d298": 1,
    "rfc3986-uri:dec-octet#d28f5154": 1,
    "rfc3986-uri:dec-octet#d9e6c0c9": 1,
    "rfc3986-uri:fragment#1e591865": 2,
    "rfc3986-uri:fragment#9d1ccafa": 2,
    "rfc3986-uri:fragment#ae36814a": 2,
    "rfc3986-uri:fragment#de4b2fc0": 2,
    "rfc3986-uri:fragment#f2479686": 2,
    "rfc3986-uri:h16#3c45e1dd": 1,
    "rfc3986-uri:h16#70905473": 1,
    "rfc3986-uri:h16#a3286fd6": 1,
    "rfc3986-uri:hier-part#18d8a445": 11,
    "rfc3986-uri:hier-part#356c5dfd": 11,
    "rfc3986-uri:hier-part#3b586367": 14,
    "rfc3986-uri:hier-part#5187bcf1": 14,
    "rfc3986-uri:hier-part#64c3585b": 3,
    "rfc3986-uri:hier-part#717e1a36": 11,
    "rfc3986-uri:hier-part#e9854769": 11,
    "rfc3986-uri:host#108ca71c": 11,
    "rfc3986-uri:host#55a6162a": 1,
    "rfc3986-uri:host#beaa09aa": 9,
    "rfc3986-uri:host#beda0476": 11,
    "rfc3986-uri:host#ed4edee0": 1,
    "rfc3986-uri:path-abempty#512caa47": 11,
    "rfc3986-uri:path-abempty#6aa39cf8": 11,
    "rfc3986-uri:path-abempty#a65ad097": 11,
    "rfc3986-uri:path-abempty#c9a58b76": 11,
    "rfc3986-uri:path-abempty#ebc23c52": 11,
    "rfc3986-uri:path-abempty#f97c23df": 11,
    "rfc3986-uri:path-rootless#049047c6": 3,
    "rfc3986-uri:path-rootless#39939737": 3,
    "rfc3986-uri:path-rootless#a75f7662": 3,
    "rfc3986-uri:path-rootless#fbcf2fbe": 3,
    "rfc3986-uri:pchar#3fe905cd": 1,
    "rfc3986-uri:pchar#ad825411": 1,
    "rfc3986-uri:pchar#d388b54a": 1,
    "rfc3986-uri:pchar#d506d5b7": 11,
    "rfc3986-uri:pchar#db22e98c": 11,
    "rfc3986-uri:pchar#dea22690": 11,
    "rfc3986-uri:pchar#f2b14903": 3,
    "rfc3986-uri:pct-encoded#383eb687": 1,
    "rfc3986-uri:pct-encoded#5a0d89a2": 1,
    "rfc3986-uri:pct-encoded#5b00e532": 1,
    "rfc3986-uri:pct-encoded#802daad4": 1,
    "rfc3986-uri:pct-encoded#fc164b7b": 1,
    "rfc3986-uri:port#423d5e5c": 2,
    "rfc3986-uri:port#c94b10c5": 2,
    "rfc3986-uri:port#cdb4d14b": 2,
    "rfc3986-uri:query#27655704": 2,
    "rfc3986-uri:query#680dddb6": 2,
    "rfc3986-uri:query#73ef8dc9": 2,
    "rfc3986-uri:query#78397244": 2,
    "rfc3986-uri:query#beefc6bd": 2,
    "rfc3986-uri:reg-name#272029db": 9,
    "rfc3986-uri:reg-name#93246571": 9,
    "rfc3986-uri:reg-name#9d008f89": 9,
    "rfc3986-uri:reg-name#b4156442": 9,
    "rfc3986-uri:reg-name#fd18b108": 9,
    "rfc3986-uri:scheme#282ca63f": 14,
    "rfc3986-uri:scheme#3b729346": 14,
    "rfc3986-uri:scheme#3e0124ce": 14,
    "rfc3986-uri:scheme#4812a24d": 14,
    "rfc3986-uri:scheme#76c12692": 14,
    "rfc3986-uri:scheme#983725dd": 14,
    "rfc3986-uri:scheme#c72c0281": 14,
    "rfc3986-uri:segment#6d46421e": 11,
    "rfc3986-uri:segment#73624c69": 11,
    "rfc3986-uri:segment#ad197556": 7,
    "rfc3986-uri:segment-nz#4c4f7001": 3,
    "rfc3986-uri:segment-nz#8152ce01": 3,
    "rfc3986-uri:segment-nz#b6de96a6": 3,
    "rfc3986-uri:sub-delims#184fd667": 2,
    "rfc3986-uri:sub-delims#3a16d993": 2,
    "rfc3986-uri:sub-delims#5bf40932": 3,
    "rfc3986-uri:sub-delims#b5e43371": 3,
    "rfc3986-uri:sub-delims#cfffeee8": 1,
    "rfc3986-uri:unreserved#0a794953": 12,
    "rfc3986-uri:unreserved#1e6db2c8": 10,
    "rfc3986-uri:unreserved#2c31cbc0": 13,
    "rfc3986-uri:unreserved#43447c51": 13,
    "rfc3986-uri:unreserved#4f307dbc": 3,
    "rfc3986-uri:unreserved#fe0d0ea9": 2,
    "rfc3986-uri:userinfo#2bf7da71": 1,
    "rfc3986-uri:userinfo#81fd5d51": 1,
    "rfc3986-uri:userinfo#bff63cff": 1,
    "rfc3986-uri:userinfo#d48af27b": 1,
    "rfc3986-uri:userinfo#f13af517": 1
  }
}
